p3,Sombrero-hp,Sombrero de la pelicula harry Potter,1800,10,Peliculas,/images/tp/sombrero-hp.jpg
p4,Scorpion,Figura de Scorpion MK en pose de espectante,1800,10,Gamer,/images/tp/scorpion.jpg
p5,Corazón llavero,Llavero con forma de corazón,1800,10,Gamer,/images/tp/2.jpg
p1,Spiderman,Figura de spiderman en pose,1350,NaN,undefined,/images/tp/spider-man.jpg
p7,toy-story,Figura de woody,10,NaN,undefined,/images/tp/toy-story.jpg
p9,Mate Vader,Mate de darth Vader,10,NaN,undefined,/images/tp/mates-darth.jpg
p7,toy-story,Figura de woody,10,NaN,undefined,/images/tp/toy-story.jpg
p1,Spiderman,Figura de spiderman en pose,20,undefined,undefined,/images/tp/spider-man.jpg